{
  "framework": "OPERATIONS",
  "title": "BPO Abstract Operations Catalogue",
  "version": "0.1.0",
  "license_note": "Operations are abstract kinds of state change that BPO properties quantify over. Function signatures listed under each operation's `examples` are platform-specific illustrations and are explicitly non-normative — the ontology does NOT commit to maintaining function-level coverage. To prevent drift toward a function catalogue, every entry in `operations[]` must be grounded in at least one current BPO property's formalization (see `inclusion_bar`); candidates without grounding are held in `candidates_pending_grounding[]` and not part of the catalogue proper.",
  "inclusion_bar": "A candidate operation X qualifies for inclusion in operations[] iff (a) X is a distinct abstract kind of state change — not a path through Op-space, not a role/scope qualifier (subset-of-Op categorisations such as `privileged`, `valueMoving`, `Consequential`, `recovery`, `Internal` do NOT qualify), not a function-signature shorthand, and not an implementation detail; AND (b) at least one BPO property's formalization treats X differently from its neighbours — different guard, different effect on the state vocabulary, or different invariant clause. If two candidates always share guards, effects, and invariants across the entire corpus, they collapse into one.",

  "operations": [
    {
      "id": "OP:TRANSFER",
      "name": "Transfer",
      "definition": "Move custody of a quantity of an asset from one principal to another while preserving total supply.",
      "state_change": "bal(s', A) decreases by q; bal(s', B) increases by q; totalSupply(s') = totalSupply(s); no system-boundary crossing.",
      "examples": [
        "ERC-20: transfer(address to, uint256 amount)",
        "ERC-20: transferFrom(address from, address to, uint256 amount)",
        "ERC-721: safeTransferFrom(address from, address to, uint256 tokenId)",
        "ERC-1155: safeBatchTransferFrom(address from, address to, uint256[] ids, uint256[] amounts, bytes data)"
      ],
      "iso20022_intents": ["ISO20022:sese.023", "ISO20022:sese.024", "ISO20022:sese.025"],
      "governs_properties": [
        { "property": "BPO:0020", "note": "Atomicity / reentrancy-safety holds at the external-call boundaries that TRANSFER triggers (e.g. ERC-777/1155 hook callbacks); not transfer-specific, but applies to TRANSFER's execution surface." },
        { "property": "BPO:0101", "note": "TRANSFER falls under the `Internal ⊆ Op` subset (supply-preserving moves); the conservation clause `∀ o ∈ Internal . V(s') = V(s)` constrains it. The supply-monotonicity guard of BPO:0001 is universal over non-mint ops and lives there, not duplicated here." }
      ],
      "notes": "Function-level examples illustrate platform realizations; the catalogue does not commit to maintaining function-level coverage."
    },
    {
      "id": "OP:MINT",
      "name": "Mint",
      "definition": "Create new supply of an asset, increasing totalSupply by an authorized amount.",
      "state_change": "totalSupply(s') = totalSupply(s) + q; bal(s', A) increases by q for the credited principal A; requires the mint capability (e.g. hasRole_MINTER).",
      "examples": [
        "ERC-20 OpenZeppelin: _mint(address to, uint256 amount)",
        "ERC-1155: _mint(address to, uint256 id, uint256 amount, bytes data)"
      ],
      "iso20022_intents": ["ISO20022:setr.044"],
      "governs_properties": [
        "BPO:0001",
        { "property": "BPO:0101", "note": "MINT is named as the sanctioned-flow `m` in BPO:0101's accounting equation V' = V + d − w + m − b; this is the value-conservation slice, distinct from the supply-monotonicity guard of BPO:0001." }
      ],
      "notes": "BPO:0001 is the primary governor (no-unauthorized-mint), formalized as `isMint(tx.selector) ∧ hasRole_MINTER` gating any positive supply change."
    },
    {
      "id": "OP:BURN",
      "name": "Burn",
      "definition": "Destroy supply of an asset, decreasing totalSupply by an authorized amount.",
      "state_change": "totalSupply(s') = totalSupply(s) − q; bal(s', A) decreases by q for the debited principal A; requires the burn capability.",
      "examples": [
        "ERC-20 OpenZeppelin: _burn(address from, uint256 amount)",
        "ERC-1155: _burn(address from, uint256 id, uint256 amount)"
      ],
      "iso20022_intents": ["ISO20022:setr.054"],
      "governs_properties": [
        { "property": "BPO:0101", "note": "BURN is the sanctioned-flow `b` in BPO:0101's accounting equation V' = V + d − w + m − b. No dedicated burn-property exists in the current corpus; the supply-monotonicity-down side is governed only by this conservation clause." }
      ],
      "notes": "Single partial governor only — a candidate for a future dedicated property (`no-unauthorized-burn`) symmetric with BPO:0001 if burn semantics start to demand a guard distinct from the conservation invariant."
    },
    {
      "id": "OP:DEPOSIT",
      "name": "Deposit",
      "definition": "Bring value into the modelled system from outside it — an external inflow that increases the system's value measure.",
      "state_change": "V(s') = V(s) + d for the deposited amount d; bal(s', A) increases for the receiving principal A; crosses the system boundary inward.",
      "examples": [
        "Bridge inbound: lock-on-source / mint-on-destination paired sequence",
        "Vault subscription: vault.deposit(uint256 assets, address receiver)"
      ],
      "iso20022_intents": ["ISO20022:setr.044"],
      "governs_properties": [
        { "property": "BPO:0101", "note": "DEPOSIT is named as the sanctioned-flow `d` in BPO:0101's accounting equation V' = V + d − w + m − b. No dedicated deposit-property exists in the current corpus." }
      ],
      "notes": "Single partial governor only — a candidate for a future deposit-correctness property if cross-boundary inflow semantics demand more than conservation alone."
    },
    {
      "id": "OP:WITHDRAW",
      "name": "Withdraw",
      "definition": "Send value from the modelled system to outside it — an external outflow that decreases the system's value measure.",
      "state_change": "V(s') = V(s) − w for the withdrawn amount w; bal(s', A) decreases for the debited principal A; crosses the system boundary outward.",
      "examples": [
        "L2 → L1 forced withdrawal: forceInclude / proveBalance / withdraw",
        "Vault redemption: vault.withdraw(uint256 assets, address receiver, address owner)"
      ],
      "iso20022_intents": ["ISO20022:setr.054"],
      "governs_properties": [
        "BPO:0002",
        { "property": "BPO:0050", "note": "Under pause, WITHDRAW is in the `valueMoving ⊆ Op` subset and is gated by the paused mode; the recovery-edge / forced-exit clause requires WITHDRAW remain reachable for entitled exits." },
        { "property": "BPO:0082", "note": "L1-rooted refinement of WITHDRAW for the L2 setting — the forceInclude → proveBalance → withdraw sequence reparents WITHDRAW's liveness obligation from the sequencer to L1." },
        { "property": "BPO:0101", "note": "WITHDRAW is the sanctioned-flow `w` in BPO:0101's accounting equation V' = V + d − w + m − b." }
      ],
      "notes": "BPO:0002 (eventual-withdrawal) is the primary governor — WITHDRAW is its principal subject."
    },

    {
      "id": "OP:GRANT",
      "name": "Grant",
      "definition": "Assign an authority (role / capability) to a principal.",
      "state_change": "hasAuth(s', p, a) := TRUE; gated by authorizedAdmin(s, sender, a).",
      "examples": [
        "OpenZeppelin AccessControl: grantRole(bytes32 role, address account)"
      ],
      "governs_properties": [
        "BPO:0040"
      ],
      "notes": "BPO:0040 names `grant` directly in its FOL and Hoare clauses as the sanctioned mutator of the authority configuration."
    },
    {
      "id": "OP:REVOKE",
      "name": "Revoke",
      "definition": "Remove an authority from a principal with immediate effect.",
      "state_change": "hasAuth(s', p, a) := FALSE; the revoked principal cannot exercise a beyond s'.",
      "examples": [
        "OpenZeppelin AccessControl: revokeRole(bytes32 role, address account)",
        "OpenZeppelin AccessControl: renounceRole(bytes32 role, address account)"
      ],
      "governs_properties": [
        "BPO:0040"
      ],
      "notes": "BPO:0040's `revocation effectiveness` clause names REVOKE explicitly: `s --[revoke(p,a)]--> s' ⇒ ¬hasAuth(s',p,a)`."
    },

    {
      "id": "OP:PAUSE",
      "name": "Pause",
      "definition": "Enter halt mode for a scope (system, account, or token); value-moving operations within the scope are disabled.",
      "state_change": "mode(σ, s') := paused; pausedAt(σ, s') := block.timestamp; value-moving transitions within σ are removed from the LTS until the scope is unpaused or auto-expires.",
      "examples": [
        "OpenZeppelin Pausable: _pause()",
        "Per-token compliance freeze (ERC-3643 style)"
      ],
      "governs_properties": [
        "BPO:0050",
        "BPO:0051"
      ],
      "notes": "Both BPO:0050 (system-scope) and BPO:0051 (account- and token-scope) name PAUSE as principal subject and strengthen the bare capability with the bounded-with-exit obligation."
    },
    {
      "id": "OP:UNPAUSE",
      "name": "Unpause",
      "definition": "Exit halt mode for a scope, restoring value-moving operations within the scope.",
      "state_change": "mode(σ, s') := active; the σ-paused transition restrictions are lifted.",
      "examples": [
        "OpenZeppelin Pausable: _unpause()",
        "Auto-unpause when block.timestamp ≥ pausedAt + maxPause (timelock variant)"
      ],
      "governs_properties": [
        "BPO:0050",
        "BPO:0051"
      ],
      "notes": "Same governors as PAUSE — the auto-unpause variant fires on clock alone and is part of the formal `bounded sojourn` clause of both BPO:0050 and BPO:0051."
    },

    {